{
  "$schema": "../schemas/project-config.schema.json",
  "project_id": "xmax-test-local",
  "benchmark_path": "BENCHMARK.md",
  "scenario_pack_path": "config/scenarios.json",
  "operation_recipe_path": "config/operation-recipes.json",
  "network_profile_path": "config/network-profiles.json",
  "default_network_profile_id": "common-tun-webrtc-v1",
  "default_max_network_retries": 3,
  "artifact_root": "var/artifacts",
  "manifest_root": "var/manifests",
  "database_path": "var/xmax-sandbox.sqlite3",
  "default_model": "x2.0",
  "default_offline_provider": "xmax",
  "default_repeats": 5,
  "xmax_api_base_url": "https://api.xmaxai.com/open/api/v1",
  "xmax_api_key_file": "../API_KEY.txt",
  "xmax_offline_quality": "hd",
  "xmax_offline_fps": 24,
  "decart_api_base_url": "https://api.decart.ai/v1",
  "decart_api_key_env": "DECART_API_KEY",
  "decart_model": "lucy-2.5",
  "decart_resolution": "720p",
  "decart_enhance_prompt": false,
  "decart_self_anchor": true,
  "decart_poll_interval_s": 2,
  "decart_timeout_s": 600,
  "decart_cost_usd_per_second": 0.04,
  "generation_modes": ["offline", "realtime"],
  "paid_run_requires_approval": true,
  "codex": {
    "binary": "/Applications/ChatGPT.app/Contents/Resources/codex",
    "timeout_seconds": 300,
    "max_retries": 2
  }
}
